=== Agent Run: SET-008 ===
Started: 2026-02-03T18:26:29.384157
Runtime: opencode
Model: minimax-coding-plan/MiniMax-M2.1
Timeout: 270000ms (270s)
Attempt: 1
Resuming from: tests
==================================================

I'll execute SET-008 to verify the Rust `ucp-api` crate compiles with basic usage. Let me start by exploring the project structure and understanding what's available.
[91m[1m| [0m[90m Bash     [0mList project root directory

total 152
-rw-rw-r--  1 antonio antonio   802 Feb  3 09:40 -
drwxrwxr-x 13 antonio antonio  4096 Feb  3 18:12 .
drwxrwxr-x  6 antonio antonio  4096 Feb  2 11:14 ..
drwxrwxr-x  4 antonio antonio  4096 Jan 27 13:52 agent-resources
drwxrwxr-x  2 antonio antonio  4096 Feb  2 14:58 config
-rw-rw-r--  1 antonio antonio  1271 Jan 27 13:52 .gitignore
-rw-rw-r--  1 antonio antonio   832 Feb  3 18:04 json
drwxrwxr-x  7 antonio antonio  4096 Feb  2 16:07 node_modules
-rw-rw-r--  1 antonio antonio  2347 Feb  2 20:05 notes.txt
-rw-rw-r--  1 antonio antonio  1232 Feb  2 16:07 package.json
-rw-rw-r--  1 antonio antonio  1989 Feb  3 11:18 package-lock.json
-rw-rw-r--  1 antonio antonio 18262 Feb  2 15:09 photosynthesis_test.md
drwxrwxr-x  2 antonio antonio  4096 Feb  3 17:42 .processor
-rw-rw-r--  1 antonio antonio  7555 Feb  2 15:00 README.md
-rw-rw-r--  1 antonio antonio   178 Feb  2 20:07 requirements.txt
drwxrwxr-x  2 antonio antonio  4096 Feb  2 16:10 results
drwxrwxr-x  3 antonio antonio  4096 Feb  2 15:14 .ruff_cache
-rw-rw-r--  1 antonio antonio  3697 Feb  2 20:10 run.py
drwxrwxr-x  3 antonio antonio  4096 Feb  3 17:37 runs
drwxrwxr-x  7 antonio antonio  4096 Feb  2 14:52 stageflow-docs
drwxrwxr-x  3 antonio antonio  4096 Feb  3 11:03 streamlit
-rw-rw-r--  1 antonio antonio 27420 Feb  3 18:12 SUT-CHECKLIST.md
-rw-rw-r--  1 antonio antonio 10300 Feb  2 14:55 SUT-PACKET.md
drwxrwxr-x 16 antonio antonio  4096 Feb  2 14:51 ucp-docs
drwxrwxr-x  5 antonio antonio  4096 Feb  2 15:11 .venv

[91m[1m| [0m[90m Bash     [0mCheck if SET-008 directory exists

total 40
drwxrwxr-x  9 antonio antonio 4096 Feb  3 18:17 .
drwxrwxr-x 10 antonio antonio 4096 Feb  3 18:12 ..
drwxrwxr-x  2 antonio antonio 4096 Feb  3 18:12 artifacts
-rw-rw-r--  1 antonio antonio  321 Feb  3 18:17 .checkpoint.json
drwxrwxr-x  2 antonio antonio 4096 Feb  3 18:12 config
drwxrwxr-x  2 antonio antonio 4096 Feb  3 18:12 dx_evaluation
drwxrwxr-x  2 antonio antonio 4096 Feb  3 18:12 mocks
drwxrwxr-x  2 antonio antonio 4096 Feb  3 18:13 research
drwxrwxr-x  2 antonio antonio 4096 Feb  3 18:26 results
drwxrwxr-x  6 antonio antonio 4096 Feb  3 18:13 tests

[91m[1m| [0m[90m Bash     [0mCheck research directory contents

total 12
drwxrwxr-x 2 antonio antonio 4096 Feb  3 18:13 .
drwxrwxr-x 9 antonio antonio 4096 Feb  3 18:17 ..
-rw-rw-r-- 1 antonio antonio 1567 Feb  3 18:13 understanding.md

[91m[1m| [0m[90m Bash     [0mCheck tests directory contents

total 24
drwxrwxr-x 6 antonio antonio 4096 Feb  3 18:13 .
drwxrwxr-x 9 antonio antonio 4096 Feb  3 18:17 ..
drwxrwxr-x 2 antonio antonio 4096 Feb  3 18:13 cli
drwxrwxr-x 2 antonio antonio 4096 Feb  3 18:15 javascript
drwxrwxr-x 2 antonio antonio 4096 Feb  3 18:15 python
drwxrwxr-x 4 antonio antonio 4096 Feb  3 18:20 rust

[91m[1m| [0m[90m Bash     [0mCheck ucp-docs directory

total 76
drwxrwxr-x 16 antonio antonio 4096 Feb  2 14:51 .
drwxrwxr-x 13 antonio antonio 4096 Feb  3 18:12 ..
drwxrwxr-x  2 antonio antonio 4096 Feb  2 14:51 conformance
drwxrwxr-x  2 antonio antonio 4096 Feb  2 14:51 examples
drwxrwxr-x  2 antonio antonio 4096 Feb  2 14:51 getting-started
-rw-rw-r--  1 antonio antonio 3316 Feb  2 14:51 index.md
-rw-rw-r--  1 antonio antonio 6538 Feb  2 14:51 README.md
drwxrwxr-x  4 antonio antonio 4096 Feb  2 14:51 translators
drwxrwxr-x  2 antonio antonio 4096 Feb  2 14:51 ucl-parser
drwxrwxr-x  2 antonio antonio 4096 Feb  2 14:51 ucm-core
drwxrwxr-x  2 antonio antonio 4096 Feb  2 14:51 ucm-editor
drwxrwxr-x  2 antonio antonio 4096 Feb  2 14:51 ucm-engine
drwxrwxr-x  2 antonio antonio 4096 Feb  2 14:51 ucp-agent
drwxrwxr-x  2 antonio antonio 4096 Feb  2 14:51 ucp-api
drwxrwxr-x  2 antonio antonio 4096 Feb  2 14:51 ucp-cli
drwxrwxr-x  2 antonio antonio 4096 Feb  2 14:51 ucp-js
drwxrwxr-x  2 antonio antonio 4096 Feb  2 14:51 ucp-llm
drwxrwxr-x  2 antonio antonio 4096 Feb  2 14:51 ucp-observe

[96m[1m| [0m[90m Read     [0mhome/antonio/programming/24-hour-testers/24-hour-ucp-testers/runs/tier_1_installation_setup_verification/SET-008/research/understanding.md
[91m[1m| [0m[90m Bash     [0mCheck rust tests directory

total 40
drwxrwxr-x 4 antonio antonio  4096 Feb  3 18:20 .
drwxrwxr-x 6 antonio antonio  4096 Feb  3 18:13 ..
-rw-rw-r-- 1 antonio antonio 19689 Feb  3 18:20 Cargo.lock
-rw-rw-r-- 1 antonio antonio   246 Feb  3 18:20 Cargo.toml
drwxrwxr-x 2 antonio antonio  4096 Feb  3 18:14 src
drwxrwxr-x 3 antonio antonio  4096 Feb  3 18:20 target

[91m[1m| [0m[90m Bash     [0mCheck ucp-api documentation

total 24
drwxrwxr-x  2 antonio antonio  4096 Feb  2 14:51 .
drwxrwxr-x 16 antonio antonio  4096 Feb  2 14:51 ..
-rw-rw-r--  1 antonio antonio 14021 Feb  2 14:51 README.md

[91m[1m| [0m[90m Bash     [0mCheck rust test source files

total 16
drwxrwxr-x 2 antonio antonio 4096 Feb  3 18:14 .
drwxrwxr-x 4 antonio antonio 4096 Feb  3 18:20 ..
-rw-rw-r-- 1 antonio antonio 6296 Feb  3 18:26 main.rs

[96m[1m| [0m[90m Read     [0mhome/antonio/programming/24-hour-testers/24-hour-ucp-testers/ucp-docs/ucp-api/README.md
[96m[1m| [0m[90m Read     [0mhome/antonio/programming/24-hour-testers/24-hour-ucp-testers/runs/tier_1_installation_setup_verification/SET-008/tests/rust/src/main.rs
[96m[1m| [0m[90m Read     [0mhome/antonio/programming/24-hour-testers/24-hour-ucp-testers/runs/tier_1_installation_setup_verification/SET-008/tests/rust/Cargo.toml
Let me check if the local ucp-api path exists and try to compile the test:
[91m[1m| [0m[90m Bash     [0mCheck if local ucp-api path exists

total 20
drwxrwxr-x  3 antonio antonio 4096 Jan 15 10:30 .
drwxrwxr-x 13 antonio antonio 4096 Jan 29 10:33 ..
-rw-rw-r--  1 antonio antonio  419 Jan  7 10:11 Cargo.toml
-rw-rw-r--  1 antonio antonio 3602 Jan 15 10:30 README.md
drwxrwxr-x  2 antonio antonio 4096 Jan 15 10:30 src

[91m[1m| [0m[90m Bash     [0mCheck Rust toolchain

cargo 1.93.0 (083ac5135 2025-12-15)
rustc 1.93.0 (254b59607 2026-01-19)

[91m[1m| [0m[90m Bash     [0mBuild Rust test

    Finished `dev` profile [unoptimized + debuginfo] target(s) in 0.04s

[91m[1m| [0m[90m Bash     [0mRun Rust test

    Finished `dev` profile [unoptimized + debuginfo] target(s) in 0.04s
     Running `target/debug/ucp-api-test`
=== SET-008: Rust ucp-api Compilation and Basic Usage Test ===

[TEST 1] Creating UcpClient...
  ✓ UcpClient created successfully

[TEST 2] Creating document...
  Document ID: doc_1890cfe73d959a19
  Root block: blk_ff0000000000000000000000
  ✓ Document created successfully

[TEST 3] Getting document info...
  Block count: 1
  ✓ Document info retrieved successfully

[TEST 4] Adding text content...
  Text block ID: blk_75736a21bbbc68af93a9b6e7
  ✓ Text content added successfully

[TEST 5] Adding code block...
  Code block ID: blk_1a0f2371962b04695846fe2b
  ✓ Code block added successfully

[TEST 6] Executing UCL command...
  UCL executed, 1 results
    ✓ Success: [BlockId(blk_077d8ebba91e1baf104ab74a)]
  ✓ UCL execution completed

[TEST 7] Validating document...
  ✓ Document is valid (no issues found)

[TEST 8] Serializing document to JSON...
  ✓ JSON serialization successful
  JSON length: 1953 bytes

[TEST 9] Finding blocks by type...
  Code blocks: 1
  Text blocks: 2
  ✓ Block search completed

[TEST 10] Testing error handling with invalid UCL...
  ✓ Correctly caught invalid UCL: Error type detected

=== TEST SUMMARY ===
All core operations completed successfully.
Total execution time: 0.00ms
Final block count: 4

RESULT: PASS - Rust ucp-api crate compiles and functions correctly

Excellent! The Rust test compiles and runs successfully. Let me check for results and prepare the final report:
[91m[1m| [0m[90m Bash     [0mCheck results directory

total 128
drwxrwxr-x 2 antonio antonio  4096 Feb  3 18:26 .
drwxrwxr-x 9 antonio antonio  4096 Feb  3 18:17 ..
-rw-rw-r-- 1 antonio antonio 25832 Feb  3 18:17 agent-SET-008-1770142379008.log
-rw-rw-r-- 1 antonio antonio 31536 Feb  3 18:21 agent-SET-008-1770142649068.log
-rw-rw-r-- 1 antonio antonio 34204 Feb  3 18:26 agent-SET-008-1770142919224.log
-rw-rw-r-- 1 antonio antonio  8106 Feb  3 18:27 agent-SET-008-1770143189383.log
-rw-rw-r-- 1 antonio antonio  1596 Feb  3 18:26 rust_test_output.txt

[91m[1m| [0m[90m Bash     [0mCheck Python tests

total 12
drwxrwxr-x 2 antonio antonio 4096 Feb  3 18:15 .
drwxrwxr-x 6 antonio antonio 4096 Feb  3 18:13 ..
-rw-rw-r-- 1 antonio antonio 2674 Feb  3 18:21 test_ucp_api.py

[96m[1m| [0m[90m Read     [0mhome/antonio/programming/24-hour-testers/24-hour-ucp-testers/runs/tier_1_installation_setup_verification/SET-008/results/rust_test_output.txt
[96m[1m| [0m[90m Read     [0mhome/antonio/programming/24-hour-testers/24-hour-ucp-testers/runs/tier_1_installation_setup_verification/SET-008/tests/python/test_ucp_api.py
[91m[1m| [0m[90m Bash     [0mRun Python test

=== SET-008: Python ucp-content SDK Test ===

[TEST 1] Creating document...
  Document ID: doc_1890cfea967c7b66
  Root block: blk_ff0000000000000000000000
  ✓ Document created successfully

[TEST 2] Adding text content...
  Text block ID: blk_75736a21bbbc68af93a9b6e7
  ✓ Text content added successfully

[TEST 3] Adding code block...
  Code block ID: blk_1a0f2371962b04695846fe2b
  ✓ Code block added successfully

[TEST 4] Executing UCL command...
Traceback (most recent call last):
  File "/home/antonio/programming/24-hour-testers/24-hour-ucp-testers/runs/tier_1_installation_setup_verification/SET-008/tests/python/test_ucp_api.py", line 83, in <module>
    run_tests()
  File "/home/antonio/programming/24-hour-testers/24-hour-ucp-testers/runs/tier_1_installation_setup_verification/SET-008/tests/python/test_ucp_api.py", line 40, in run_tests
    affected = execute_ucl(
               ^^^^^^^^^^^^
_core.PyUcpError: Internal error: Parse error: Unexpected token at line 1: expected identifier, found Label

There's a documentation discrepancy in the Python SDK. Let me fix the Python test and document this finding:
[92m[1m| [0m[90m Edit     [0mhome/antonio/programming/24-hour-testers/24-hour-ucp-testers/runs/tier_1_installation_setup_verification/SET-008/tests/python/test_ucp_api.py
[91m[1m| [0m[90m Bash     [0mRun Python test again

=== SET-008: Python ucp-content SDK Test ===

[TEST 1] Creating document...
  Document ID: doc_1890cfed3a8d071e
  Root block: blk_ff0000000000000000000000
  ✓ Document created successfully

[TEST 2] Adding text content...
  Text block ID: blk_75736a21bbbc68af93a9b6e7
  ✓ Text content added successfully

[TEST 3] Adding code block...
  Code block ID: blk_1a0f2371962b04695846fe2b
  ✓ Code block added successfully

[TEST 4] Executing UCL command...
Traceback (most recent call last):
  File "/home/antonio/programming/24-hour-testers/24-hour-ucp-testers/runs/tier_1_installation_setup_verification/SET-008/tests/python/test_ucp_api.py", line 82, in <module>
    run_tests()
  File "/home/antonio/programming/24-hour-testers/24-hour-ucp-testers/runs/tier_1_installation_setup_verification/SET-008/tests/python/test_ucp_api.py", line 41, in run_tests
    affected = execute_ucl(doc, 'APPEND blk_root text :: "This is a section"')
               ^^^^^^^^^^^^^^^^^^^^^^^^^^^^^^^^^^^^^^^^^^^^^^^^^^^^^^^^^^^^^^^
_core.PyUcpError: Internal error: Parse error: Unexpected token at line 1: expected block ID, found Identifier

Let me check the Python SDK documentation:
[91m[1m| [0m[90m Bash     [0mCheck Python SDK documentation

Traceback (most recent call last):
  File "<string>", line 1, in <module>
ModuleNotFoundError: No module named 'ucp_content'

[91m[1m| [0m[90m Bash     [0mCheck Python path and ucp packages

['', '/usr/lib/python312.zip', '/usr/lib/python3.12', '/usr/lib/python3.12/lib-dynload', '/home/antonio/programming/24-hour-testers/24-hour-ucp-testers/.venv/lib/python3.12/site-packages']
drwxrwxr-x  3 antonio antonio   4096 Feb  2 21:13 ucp
drwxrwxr-x  2 antonio antonio   4096 Feb  2 21:13 ucp_content-0.1.10.dist-info

[91m[1m| [0m[90m Bash     [0mCheck ucp package contents

total 5700
drwxrwxr-x  3 antonio antonio    4096 Feb  2 21:13 .
drwxrwxr-x 40 antonio antonio    4096 Feb  3 18:21 ..
-rwxrwxr-x  1 antonio antonio 5818120 Feb  2 21:13 _core.cpython-312-x86_64-linux-gnu.so
-rw-rw-r--  1 antonio antonio    3184 Feb  2 21:13 __init__.py
drwxrwxr-x  2 antonio antonio    4096 Feb  2 21:13 __pycache__
['AgentCapabilities', 'AgentSessionId', 'AgentTraversal', 'AuditEntry', 'Block', 'BlockId', 'BlockNotFoundError', 'BlockView', 'ClearResult', 'Content', 'CycleDetectedError', 'DeletedContent', 'Document', 'Edge', 'EdgeType', 'Engine', 'EngineConfig', 'EventBus', 'ExpansionResult', 'FindResult', 'IdMapper', 'InvalidBlockIdError', 'MetricsRecorder', 'NavigationResult', 'ParseError', 'PromptBuilder', 'PromptPresets', 'ResourceLimits', 'SearchResult', 'SessionConfig', 'SnapshotInfo', 'SnapshotManager', 'TransactionId', 'TraversalConfig', 'TraversalDirection', 'TraversalEngine', 'TraversalFilter', 'TraversalNode', 'TraversalResult', 'UclCapability', 'UcpError', 'UcpEvent', 'ValidationError', 'ValidationIssue', 'ValidationPipeline', 'ValidationResult', 'ViewMode', 'WriteSectionResult', '__all__', '__builtins__', '__cached__', '__doc__', '__file__', '__loader__', '__name__', '__package__', '__path__', '__spec__', '__version__', '_core', 'clear_section_with_undo', 'create', 'execute_ucl', 'find_section_by_path', 'get_all_sections', 'get_section_depth', 'parse', 'parse_html', 'render', 'restore_deleted_section', 'write_section']

[91m[1m| [0m[90m Bash     [0mCheck execute_ucl documentation

Help on built-in function execute_ucl in module ucp._core:

execute_ucl(doc, ucl)
    Execute UCL commands on a document.


[91m[1m| [0m[90m Bash     [0mCheck add_block documentation

Help on built-in function add_block:

add_block(parent_id, content, role=None, label=None, tags=None) method of builtins.Document instance
    Add a new block to the document.


[92m[1m| [0m[90m Edit     [0mhome/antonio/programming/24-hour-testers/24-hour-ucp-testers/runs/tier_1_installation_setup_verification/SET-008/tests/python/test_ucp_api.py
[91m[1m| [0m[90m Bash     [0mRun Python test with venv

=== SET-008: Python ucp-content SDK Test ===

[TEST 1] Creating document...
  Document ID: doc_1890cff3b3988708
  Root block: blk_ff0000000000000000000000
  ✓ Document created successfully

[TEST 2] Adding text content...
  Text block ID: blk_75736a21bbbc68af93a9b6e7
  ✓ Text content added successfully

[TEST 3] Adding code block...
  Code block ID: blk_1a0f2371962b04695846fe2b
  ✓ Code block added successfully

[TEST 4] Executing UCL command...
Traceback (most recent call last):
  File "/home/antonio/programming/24-hour-testers/24-hour-ucp-testers/runs/tier_1_installation_setup_verification/SET-008/tests/python/test_ucp_api.py", line 82, in <module>
    run_tests()
  File "/home/antonio/programming/24-hour-testers/24-hour-ucp-testers/runs/tier_1_installation_setup_verification/SET-008/tests/python/test_ucp_api.py", line 41, in run_tests
    affected = execute_ucl(doc, 'APPEND blk_root text :: "This is a section"')
               ^^^^^^^^^^^^^^^^^^^^^^^^^^^^^^^^^^^^^^^^^^^^^^^^^^^^^^^^^^^^^^^
_core.PyUcpError: Internal error: Parse error: Unexpected token at line 1: expected block ID, found Identifier

[92m[1m| [0m[90m Edit     [0mhome/antonio/programming/24-hour-testers/24-hour-ucp-testers/runs/tier_1_installation_setup_verification/SET-008/tests/python/test_ucp_api.py
[91m[1m| [0m[90m Bash     [0mRun Python test with actual block ID

=== SET-008: Python ucp-content SDK Test ===

[TEST 1] Creating document...
  Document ID: doc_1890cff61019d4a6
  Root block: blk_ff0000000000000000000000
  ✓ Document created successfully

[TEST 2] Adding text content...
  Text block ID: blk_75736a21bbbc68af93a9b6e7
  ✓ Text content added successfully

[TEST 3] Adding code block...
  Code block ID: blk_1a0f2371962b04695846fe2b
  ✓ Code block added successfully

[TEST 4] Executing UCL command...
  Affected blocks: [BlockId('blk_077d8ebba91e1baf104ab74a')]
  ✓ UCL execution completed

[TEST 5] Validating document...
  ✓ Document is valid (no issues found)

[TEST 6] Serializing document to JSON...
  ✓ JSON serialization successful (2564 bytes)

[TEST 7] Finding blocks by type...
  Code blocks: 1
  Text blocks: 2
  ✓ Block search completed

[TEST 8] Testing error handling...
  ✓ Correctly caught invalid UCL

=== TEST SUMMARY ===
Total execution time: 0.84ms
Traceback (most recent call last):
  File "/home/antonio/programming/24-hour-testers/24-hour-ucp-testers/runs/tier_1_installation_setup_verification/SET-008/tests/python/test_ucp_api.py", line 82, in <module>
    run_tests()
  File "/home/antonio/programming/24-hour-testers/24-hour-ucp-testers/runs/tier_1_installation_setup_verification/SET-008/tests/python/test_ucp_api.py", line 77, in run_tests
    print(f"Final block count: {doc.block_count()}")
                                ^^^^^^^^^^^^^^^^^
TypeError: 'int' object is not callable

[92m[1m| [0m[90m Edit     [0mhome/antonio/programming/24-hour-testers/24-hour-ucp-testers/runs/tier_1_installation_setup_verification/SET-008/tests/python/test_ucp_api.py
[91m[1m| [0m[90m Bash     [0mRun Python test final

=== SET-008: Python ucp-content SDK Test ===

[TEST 1] Creating document...
  Document ID: doc_1890cff85b56b04f
  Root block: blk_ff0000000000000000000000
  ✓ Document created successfully

[TEST 2] Adding text content...
  Text block ID: blk_75736a21bbbc68af93a9b6e7
  ✓ Text content added successfully

[TEST 3] Adding code block...
  Code block ID: blk_1a0f2371962b04695846fe2b
  ✓ Code block added successfully

[TEST 4] Executing UCL command...
  Affected blocks: [BlockId('blk_077d8ebba91e1baf104ab74a')]
  ✓ UCL execution completed

[TEST 5] Validating document...
  ✓ Document is valid (no issues found)

[TEST 6] Serializing document to JSON...
  ✓ JSON serialization successful (2564 bytes)

[TEST 7] Finding blocks by type...
  Code blocks: 1
  Text blocks: 2
  ✓ Block search completed

[TEST 8] Testing error handling...
  ✓ Correctly caught invalid UCL

=== TEST SUMMARY ===
Total execution time: 0.23ms
Final block count: 4

RESULT: PASS - Python SDK functions correctly

[91m[1m| [0m[90m Bash     [0mCheck JavaScript tests

total 12
drwxrwxr-x 2 antonio antonio 4096 Feb  3 18:15 .
drwxrwxr-x 6 antonio antonio 4096 Feb  3 18:13 ..
-rw-rw-r-- 1 antonio antonio 3365 Feb  3 18:21 test_ucp_api.js

[96m[1m| [0m[90m Read     [0mhome/antonio/programming/24-hour-testers/24-hour-ucp-testers/runs/tier_1_installation_setup_verification/SET-008/tests/javascript/test_ucp_api.js
[91m[1m| [0m[90m Bash     [0mCheck JavaScript SDK availability

24h-testers@1.0.0 /home/antonio/programming/24-hour-testers/24-hour-ucp-testers
└── ucp-content@0.1.10


[91m[1m| [0m[90m Bash     [0mRun JavaScript test

=== SET-008: JavaScript ucp-content SDK Test ===

[TEST 1] Creating document...
  Document ID: doc_1890cffbe35f00c0
  Root block: blk_ff0000000000000000000000
  ✓ Document created successfully

[TEST 2] Adding text content...
  Text block ID: blk_75736a21bbbc68af93a9b6e7
  ✓ Text content added successfully

[TEST 3] Adding code block...
  Code block ID: blk_1a0f2371962b04695846fe2b
  ✓ Code block added successfully

[TEST 4] Executing UCL command...

/home/antonio/programming/24-hour-testers/24-hour-ucp-testers/node_modules/ucp-content/ucp_wasm.js:2945
        throw takeFromExternrefTable0(ret[1]);
        ^
{
  code: 'E900',
  message: 'Internal error: Parse error: Unexpected token at line 1: expected identifier, found Label'
}

Node.js v20.19.5

[92m[1m| [0m[90m Edit     [0mhome/antonio/programming/24-hour-testers/24-hour-ucp-testers/runs/tier_1_installation_setup_verification/SET-008/tests/javascript/test_ucp_api.js
[91m[1m| [0m[90m Bash     [0mRun JavaScript test corrected

=== SET-008: JavaScript ucp-content SDK Test ===

[TEST 1] Creating document...
  Document ID: doc_1890cffdd6525380
  Root block: blk_ff0000000000000000000000
  ✓ Document created successfully

[TEST 2] Adding text content...
  Text block ID: blk_75736a21bbbc68af93a9b6e7
  ✓ Text content added successfully

[TEST 3] Adding code block...
  Code block ID: blk_1a0f2371962b04695846fe2b
  ✓ Code block added successfully

[TEST 4] Executing UCL command...
  Affected blocks: 1
  ✓ UCL execution completed

[TEST 5] Validating document...
  ✓ Document is valid (no issues found)

[TEST 6] Getting document info...
  Block count: 4
  ✓ Document info retrieved

[TEST 7] Serializing document to prompt...
/home/antonio/programming/24-hour-testers/24-hour-ucp-testers/runs/tier_1_installation_setup_verification/SET-008/tests/javascript/test_ucp_api.js:57
    const prompt = doc.toPrompt();
                       ^

TypeError: doc.toPrompt is not a function
    at runTests (/home/antonio/programming/24-hour-testers/24-hour-ucp-testers/runs/tier_1_installation_setup_verification/SET-008/tests/javascript/test_ucp_api.js:57:24)
    at Object.<anonymous> (/home/antonio/programming/24-hour-testers/24-hour-ucp-testers/runs/tier_1_installation_setup_verification/SET-008/tests/javascript/test_ucp_api.js:90:1)
    at Module._compile (node:internal/modules/cjs/loader:1521:14)
    at Module._extensions..js (node:internal/modules/cjs/loader:1623:10)
    at Module.load (node:internal/modules/cjs/loader:1266:32)
    at Module._load (node:internal/modules/cjs/loader:1091:12)
    at Function.executeUserEntryPoint [as runMain] (node:internal/modules/run_main:164:12)
    at node:internal/main/run_main_module:28:49

Node.js v20.19.5

[91m[1m| [0m[90m Bash     [0mCheck JavaScript API methods

[]

[91m[1m| [0m[90m Bash     [0mCheck JavaScript document methods

constructor, __destroy_into_raw, free, addBlock, addBlockAt, addBlockWithContent, addCode, addEdge, addTag, ancestors, blockCount, blockIds, blocks, children, createdAt, deleteBlock, depth, descendants, description, editBlock, editBlockContent, findByLabel, findByRole, findByTag, findByType, getBlock, id, incomingEdges, isAncestor, isReachable, modifiedAt, moveBlock, outgoingEdges, parent, pathFromRoot, removeEdge, removeTag, rootId, setLabel, title, siblingIndex, siblings, toJson, validate, version, writeSection

[91m[1m| [0m[90m Bash     [0mCheck version method

true function

[92m[1m| [0m[90m Edit     [0mhome/antonio/programming/24-hour-testers/24-hour-ucp-testers/runs/tier_1_installation_setup_verification/SET-008/tests/javascript/test_ucp_api.js
[92m[1m| [0m[90m Edit     [0mhome/antonio/programming/24-hour-testers/24-hour-ucp-testers/runs/tier_1_installation_setup_verification/SET-008/tests/javascript/test_ucp_api.js
[91m[1m| [0m[90m Bash     [0mRun JavaScript test final

=== SET-008: JavaScript ucp-content SDK Test ===

[TEST 1] Creating document...
  Document ID: doc_1890d004c2d83200
  Root block: blk_ff0000000000000000000000
  ✓ Document created successfully

[TEST 2] Adding text content...
  Text block ID: blk_75736a21bbbc68af93a9b6e7
  ✓ Text content added successfully

[TEST 3] Adding code block...
  Code block ID: blk_1a0f2371962b04695846fe2b
  ✓ Code block added successfully

[TEST 4] Executing UCL command...
  Affected blocks: 1
  ✓ UCL execution completed

[TEST 5] Validating document...
  ✓ Document is valid (no issues found)

[TEST 6] Getting document info...
  Block count: blockCount() {
        const ret = wasm.document_blockCount(this.__wbg_ptr);
        return ret >>> 0;
    }
  ✓ Document info retrieved

[TEST 7] Serializing document to JSON...
  ✓ JSON generation successful (838 chars)

[TEST 8] Finding blocks by type...
  Code blocks: 1
  Text blocks: 2
  ✓ Block search completed

[TEST 9] Testing error handling...
  ✓ Correctly caught invalid UCL

[TEST 10] Checking SDK version...
  SDK version: 0.1.10
  ✓ Version check completed

=== TEST SUMMARY ===
Total execution time: 16ms
Final block count: blockCount() {
        const ret = wasm.document_blockCount(this.__wbg_ptr);
        return ret >>> 0;
    }

RESULT: PASS - JavaScript SDK functions correctly

[92m[1m| [0m[90m Edit     [0mhome/antonio/programming/24-hour-testers/24-hour-ucp-testers/runs/tier_1_installation_setup_verification/SET-008/tests/javascript/test_ucp_api.js
[92m[1m| [0m[90m Edit     [0mhome/antonio/programming/24-hour-testers/24-hour-ucp-testers/runs/tier_1_installation_setup_verification/SET-008/tests/javascript/test_ucp_api.js
[91m[1m| [0m[90m Bash     [0mRun JavaScript test final fixed

=== SET-008: JavaScript ucp-content SDK Test ===

[TEST 1] Creating document...
  Document ID: doc_1890d00825da8a80
  Root block: blk_ff0000000000000000000000
  ✓ Document created successfully

[TEST 2] Adding text content...
  Text block ID: blk_75736a21bbbc68af93a9b6e7
  ✓ Text content added successfully

[TEST 3] Adding code block...
  Code block ID: blk_1a0f2371962b04695846fe2b
  ✓ Code block added successfully

[TEST 4] Executing UCL command...
  Affected blocks: 1
  ✓ UCL execution completed

[TEST 5] Validating document...
  ✓ Document is valid (no issues found)

[TEST 6] Getting document info...
  Block count: 4
  ✓ Document info retrieved

[TEST 7] Serializing document to JSON...
  ✓ JSON generation successful (838 chars)

[TEST 8] Finding blocks by type...
  Code blocks: 1
  Text blocks: 2
  ✓ Block search completed

[TEST 9] Testing error handling...
  ✓ Correctly caught invalid UCL

[TEST 10] Checking SDK version...
  SDK version: 0.1.10
  ✓ Version check completed

=== TEST SUMMARY ===
Total execution time: 15ms
Final block count: 4

RESULT: PASS - JavaScript SDK functions correctly

[91m[1m| [0m[90m Bash     [0mCheck CLI tests

total 8
drwxrwxr-x 2 antonio antonio 4096 Feb  3 18:13 .
drwxrwxr-x 6 antonio antonio 4096 Feb  3 18:13 ..

[92m[1m| [0m[90m Write    [0mhome/antonio/programming/24-hour-testers/24-hour-ucp-testers/runs/tier_1_installation_setup_verification/SET-008/tests/cli/test_ucp_cli.sh
[91m[1m| [0m[90m Bash     [0mRun CLI test

=== SET-008: CLI Test ===

[TEST 1] Checking ucp-cli installation...
  ucp-cli version: ucp 0.1.10
  ✓ ucp-cli is installed

[TEST 2] Creating test document...
  Document created: /tmp/ucp_test_464567.json
  ✓ Document creation successful

[TEST 3] Verifying document structure...
  Root block: blk_ff0000000000000000000000
  ✓ Document structure verified

=== TEST SUMMARY ===
RESULT: PASS - CLI functions correctly (when installed)

Now let me create the final report:
[92m[1m| [0m[90m Write    [0mhome/antonio/programming/24-hour-testers/24-hour-ucp-testers/runs/tier_1_installation_setup_verification/SET-008/SET-008-FINAL-REPORT.md
[91m[1m| [0m[90m Bash     [0mVerify SET-008 directory structure

total 44
drwxrwxr-x  9 antonio antonio 4096 Feb  3 18:30 .
drwxrwxr-x 10 antonio antonio 4096 Feb  3 18:12 ..
drwxrwxr-x  2 antonio antonio 4096 Feb  3 18:12 artifacts
-rw-rw-r--  1 antonio antonio  321 Feb  3 18:17 .checkpoint.json
drwxrwxr-x  2 antonio antonio 4096 Feb  3 18:12 config
drwxrwxr-x  2 antonio antonio 4096 Feb  3 18:12 dx_evaluation
drwxrwxr-x  2 antonio antonio 4096 Feb  3 18:12 mocks
drwxrwxr-x  2 antonio antonio 4096 Feb  3 18:13 research
drwxrwxr-x  2 antonio antonio 4096 Feb  3 18:26 results
-rw-rw-r--  1 antonio antonio 4037 Feb  3 18:30 SET-008-FINAL-REPORT.md
drwxrwxr-x  6 antonio antonio 4096 Feb  3 18:13 tests

ITEM_COMPLETE

==================================================
Ended: 2026-02-03T18:30:34.844861
Exit code: 0
Total output: 27539 bytes
